{
  "schema": 2,
  "id": "finding:2866c2e067ef17ca",
  "lens": "exact",
  "severity": "medium",
  "criterion": "AC-config-explicit-wins",
  "invariant": "Explicit request options override stored defaults",
  "evidence_ids": ["receipt:config-regression"],
  "affected_behavior": "Wrapper caller returns the explicit mode",
  "smallest_repair": "Reverse the merge order in the shared resolver",
  "verification": "Run the direct and wrapper behavioral regression",
  "status": "open"
}
